{
  "cases": [
    {
      "agent_view": {
        "authority": {
          "authority_id": "auth-01",
          "captured_version": 1,
          "commitment": "1288e7f3752eade33477bab40190f37bbc7c1b31db7dd36d1b4ebc720fee588c",
          "current_version": 1,
          "effective_at": "2026-08-28T10:24:12Z",
          "permitted_actions": [
            "recall",
            "revalidate"
          ],
          "status": "active"
        },
        "case_id": "vet-01",
        "controls": {
          "workspace_scope": "workspace-orbit"
        },
        "experiences": [
          {
            "approach_outcome": "verified_success",
            "approach_type": "worked",
            "evidence": [
              {
                "capture_mode": "hash_only",
                "commitment": "3205966f22eb484e8a262ff8d538bc494eff5d82bde72a4e1fc6be38c83ccc54",
                "evidence_id": "ev-01-primary",
                "quality": "sufficient",
                "source_id": "src-01-primary",
                "status": "verified",
                "valid_from": "2026-08-24T06:40:04Z",
                "valid_to": null
              }
            ],
            "experience_id": "exp-01-primary",
            "lineage": {
              "commitment": "4970558cf1815279206d090bf48045845b4a6504101f99621bcd9c5d5dce0696",
              "derivation_status": "direct",
              "parent_experience_ids": [],
              "raw_source_status": "available"
            },
            "memory_id": "mem-01-primary",
            "scope": "workspace-orbit",
            "source": {
              "capture_mode": "hash_only",
              "captured_at": "2026-08-22T04:18:30Z",
              "commitment": "e49256ad289a4ac28736d78aa4d8264715a6565a89ddd6135b99ce11261122c9",
              "scope": "workspace-orbit",
              "source_id": "src-01-primary"
            },
            "validity_status": "current",
            "world_state_hash": "d902051a20eb757fe302ec98ea3bf9693054a5a0772273844f68c656af05852e"
          }
        ],
        "revalidation": {
          "checked_at": "2026-08-20T11:35:29Z",
          "commitment": "37fb508d78fa82ba7806decfa42b3e586d76c475d882bfa7f92c9cb70cb4167a",
          "current_world_state_hash": "d902051a20eb757fe302ec98ea3bf9693054a5a0772273844f68c656af05852e",
          "performed": false,
          "required": false,
          "result": "not_run"
        },
        "task_b": {
          "goal_code": "goal_family_1",
          "requested_operation": "reuse_experience",
          "task_id": "task-b-01",
          "world_state_hash": "d902051a20eb757fe302ec98ea3bf9693054a5a0772273844f68c656af05852e",
          "world_state_id": "world-01-v2",
          "world_version": 2
        },
        "world": {
          "facts_code": "current_facts_01",
          "state_hash": "d902051a20eb757fe302ec98ea3bf9693054a5a0772273844f68c656af05852e",
          "status": "current",
          "version": 2,
          "world_state_id": "world-01-v2"
        }
      },
      "agent_view_sha256": "ebdb01429d313f846db63a8a82941ce87b20e94ecafa3c5d959cbfb33d4084f6",
      "case_id": "vet-01",
      "deterministic_seed": 20260830,
      "pair_id": "pair-01"
    },
    {
      "agent_view": {
        "authority": {
          "authority_id": "auth-02",
          "captured_version": 1,
          "commitment": "c9a176db5a15a5c1d7e1cc2d89985d2d64d261ec5f421fdfa20e20824cb94514",
          "current_version": 1,
          "effective_at": "2026-08-20T13:31:25Z",
          "permitted_actions": [
            "recall",
            "revalidate"
          ],
          "status": "active"
        },
        "case_id": "vet-02",
        "controls": {
          "workspace_scope": "workspace-quartz"
        },
        "experiences": [
          {
            "approach_outcome": "verified_success",
            "approach_type": "worked",
            "evidence": [
              {
                "capture_mode": "hash_only",
                "commitment": "906ccab2c8202f60d2390978ef391b0cb77e1db9e132682087e8e520a711766a",
                "evidence_id": "ev-02-primary",
                "quality": "sufficient",
                "source_id": "src-02-primary",
                "status": "verified",
                "valid_from": "2026-08-25T09:47:17Z",
                "valid_to": null
              }
            ],
            "experience_id": "exp-02-primary",
            "lineage": {
              "commitment": "3af0bc7eb1164eb1c36f525d57360bd8bd050d0404020e8a8e53dbb13fe9a58f",
              "derivation_status": "direct",
              "parent_experience_ids": [],
              "raw_source_status": "available"
            },
            "memory_id": "mem-02-primary",
            "scope": "workspace-quartz",
            "source": {
              "capture_mode": "hash_only",
              "captured_at": "2026-08-23T07:25:43Z",
              "commitment": "08d6dd2a5bb0e4c6485fbc587f23ff339da0260fe7cd50aea2361ea9a6b797fa",
              "scope": "workspace-quartz",
              "source_id": "src-02-primary"
            },
            "validity_status": "current",
            "world_state_hash": "035549e2b836898fc8ee175a2615c8264b9f3a9a5a30fcb642b2ebb2a618c426"
          }
        ],
        "revalidation": {
          "checked_at": "2026-08-21T14:42:42Z",
          "commitment": "c796250b60a5ddae557587563ccf2b8368aecb85aaeafe4a8206b7371772ab8f",
          "current_world_state_hash": "035549e2b836898fc8ee175a2615c8264b9f3a9a5a30fcb642b2ebb2a618c426",
          "performed": false,
          "required": false,
          "result": "not_run"
        },
        "task_b": {
          "goal_code": "goal_family_2",
          "requested_operation": "reuse_experience",
          "task_id": "task-b-02",
          "world_state_hash": "035549e2b836898fc8ee175a2615c8264b9f3a9a5a30fcb642b2ebb2a618c426",
          "world_state_id": "world-02-v2",
          "world_version": 2
        },
        "world": {
          "facts_code": "current_facts_02",
          "state_hash": "035549e2b836898fc8ee175a2615c8264b9f3a9a5a30fcb642b2ebb2a618c426",
          "status": "current",
          "version": 2,
          "world_state_id": "world-02-v2"
        }
      },
      "agent_view_sha256": "ce056e8d1d4bb69f862cb133f861a65bca1ae980ff2a42a06e5814f818c0d142",
      "case_id": "vet-02",
      "deterministic_seed": 20260831,
      "pair_id": "pair-02"
    },
    {
      "agent_view": {
        "authority": {
          "authority_id": "auth-03",
          "captured_version": 1,
          "commitment": "cdae0352baf0cee3636b25992d69d1c3e8d6f75a7a383642b52255cb910836c2",
          "current_version": 1,
          "effective_at": "2026-08-21T16:38:38Z",
          "permitted_actions": [
            "recall",
            "revalidate"
          ],
          "status": "active"
        },
        "case_id": "vet-03",
        "controls": {
          "workspace_scope": "workspace-harbor"
        },
        "experiences": [
          {
            "approach_outcome": "verified_success",
            "approach_type": "worked",
            "evidence": [
              {
                "capture_mode": "hash_only",
                "commitment": "129bbf4f020a3e5d1e500324c30d2a3d144767c3730e5d4dd6048a6d3da4cbb6",
                "evidence_id": "ev-03-primary",
                "quality": "sufficient",
                "source_id": "src-03-primary",
                "status": "verified",
                "valid_from": "2026-08-26T12:54:30Z",
                "valid_to": null
              }
            ],
            "experience_id": "exp-03-primary",
            "lineage": {
              "commitment": "941659f5109cfc8fb428cc48a7b225ce9feb635ebd087305aca612a3cdb83ec5",
              "derivation_status": "direct",
              "parent_experience_ids": [],
              "raw_source_status": "available"
            },
            "memory_id": "mem-03-primary",
            "scope": "workspace-harbor",
            "source": {
              "capture_mode": "hash_only",
              "captured_at": "2026-08-24T10:32:56Z",
              "commitment": "1a430f3dfdbde47b210e13da789c68ec149769d5771cf6667515d1afa29586f4",
              "scope": "workspace-harbor",
              "source_id": "src-03-primary"
            },
            "validity_status": "current",
            "world_state_hash": "0cab68af9701b104001dce6f7952c87020c52e605698c2a4772e73331702b9bd"
          }
        ],
        "revalidation": {
          "checked_at": "2026-08-22T17:49:55Z",
          "commitment": "3f5c1766661cf39b48c00cd563c48157b740eda9c0d38a743993a33931a1a621",
          "current_world_state_hash": "0cab68af9701b104001dce6f7952c87020c52e605698c2a4772e73331702b9bd",
          "performed": false,
          "required": false,
          "result": "not_run"
        },
        "task_b": {
          "goal_code": "goal_family_3",
          "requested_operation": "reuse_experience",
          "task_id": "task-b-03",
          "world_state_hash": "0cab68af9701b104001dce6f7952c87020c52e605698c2a4772e73331702b9bd",
          "world_state_id": "world-03-v2",
          "world_version": 2
        },
        "world": {
          "facts_code": "current_facts_03",
          "state_hash": "0cab68af9701b104001dce6f7952c87020c52e605698c2a4772e73331702b9bd",
          "status": "current",
          "version": 2,
          "world_state_id": "world-03-v2"
        }
      },
      "agent_view_sha256": "3c8511867ed38d9e45bb9b009b49d4cc7d421166a882d31f1c7ea7f189c35e20",
      "case_id": "vet-03",
      "deterministic_seed": 20260832,
      "pair_id": "pair-03"
    },
    {
      "agent_view": {
        "authority": {
          "authority_id": "auth-04",
          "captured_version": 1,
          "commitment": "d1fad026d0d7cd4ade45fd8733d6d65dd5f2b66ac4fb8efda0956f0575e58f0d",
          "current_version": 1,
          "effective_at": "2026-08-22T19:45:51Z",
          "permitted_actions": [
            "recall",
            "revalidate"
          ],